[
  {
    "slug": "cynthia-leis",
    "name": "Cynthia Leis",
    "entity_key": null,
    "aliases": [
      "Cindy Leis",
      "Cynthia 'Cindy' Leis",
      "Cynthia C. Leis"
    ],
    "roles": [
      "economic-development principal",
      "records custodian",
      "port-authority director"
    ],
    "affiliations": [
      "Allen Economic Development Group (AEDG)",
      "Port Authority of Allen County (PAAC)"
    ],
    "summary": "AEDG President/CEO AND PAAC Executive Director — the single locus of control over the economic-development trade-secret shield and the records custody for Project BOSC.",
    "expanded": true,
    "tags": [
      "aedg",
      "paac",
      "dual-role",
      "records",
      "locus-of-control"
    ],
    "sources": [
      {
        "source": "data/extracted/aedg/paac-records-policy.policy.yaml",
        "source_kind": "document",
        "page": null,
        "confidence": "medium",
        "note": null,
        "verified": true
      },
      {
        "source": "data/extracted/aedg/paac-board-minutes.minutes.yaml",
        "source_kind": "document",
        "page": null,
        "confidence": "medium",
        "note": null,
        "verified": true
      },
      {
        "source": "data/extracted/legal/prr-mandamus/school-district-notice-letters.notice.yaml",
        "source_kind": "document",
        "page": null,
        "confidence": "medium",
        "note": null,
        "verified": true
      }
    ],
    "body": "## How she appears in the record\n\nCynthia \"Cindy\" Leis occupies **two seats at once** in the Project BOSC corpus:\n\n- **President/CEO of the Allen Economic Development Group (AEDG)** — she signs the\n  Elida Local School District notice letters as AEDG President/CEO (`leisc@aedg.org`),\n  and the PAAC board minutes track her rise from AEDG Business Development Director\n  to President/CEO by August 2024.\n- **Executive Director of the Port Authority of Allen County (PAAC)** — she signs the\n  PAAC records policy in that capacity, and recurs throughout the board minutes\n  reporting on the deal (e.g. 2026-03-30, tying the N. Cole Street roadway\n  improvements to \"the Google data center project\").\n\n## Why the dual role matters\n\nPAAC has **no employees** of its own; it must be administered by an external entity\n([records policy](../extracted/aedg/paac-records-policy.policy.yaml)). With Leis serving as\n**both** AEDG President/CEO and PAAC Executive Director, the same individual sits on\nboth sides of the front-end developer-information shield (R.C. 4582.58 — developer\ninformation routed *through AEDG* is treated as a non-record until the employer commits\nin writing) **and** the records custody for the public authority that approves the\ndeal. That single locus of control over the econ-dev shield + records is the core of\nthe records-completeness concern. See the memory note `leis-aedg-paac-dual-role`.\n\nIn the board minutes she describes roundabout phasing to objecting residents\n(2025-08-07), and the PAAC board invokes the R.C. 4582.58(B) trade-secret shield to\nenter executive session (2026-03-30) — the shield in active use.\n\n## Research status\n\nRoles and the dual capacity are read directly from the cited extractions and are\n**common-control plumbing and leads to verify — not** statements about beneficial\nownership or wrongdoing. To extend: confirm the exact AEDG/PAAC contractual\nadministration arrangement and the dates of each appointment from primary records."
  },
  {
    "slug": "jill-tangeman",
    "name": "Jill Tangeman",
    "entity_key": "JILL TANGEMAN",
    "aliases": [
      "Jill S. Tangeman",
      "Jill S. Tangeman Esq."
    ],
    "roles": [
      "company counsel",
      "permit contact"
    ],
    "affiliations": [
      "Vorys",
      "Sater",
      "Seymour and Pease LLP"
    ],
    "summary": "Vorys counsel for Bistrozzi LLC — company counsel on the Roadwork Development Agreement, the land-option assignments, and a recurring contact of record across the EPA permit file.",
    "expanded": true,
    "tags": [
      "counsel",
      "vorys",
      "bistrozzi",
      "land"
    ],
    "sources": [
      {
        "source": "data/extracted/permits/3949585.epa.yaml",
        "source_kind": "document",
        "page": null,
        "confidence": "medium",
        "note": null,
        "verified": true
      },
      {
        "source": "data/extracted/permits/4006230.epa.yaml",
        "source_kind": "document",
        "page": null,
        "confidence": "medium",
        "note": null,
        "verified": true
      },
      {
        "source": "data/extracted/permits/3974496.epa.yaml",
        "source_kind": "document",
        "page": null,
        "confidence": "medium",
        "note": null,
        "verified": true
      },
      {
        "source": "data/extracted/aedg/roadwork-development-agreement.rda.yaml",
        "source_kind": "document",
        "page": null,
        "confidence": "medium",
        "note": null,
        "verified": true
      },
      {
        "source": "data/extracted/aedg/seller-land-packets.land.yaml",
        "source_kind": "document",
        "page": null,
        "confidence": "medium",
        "note": null,
        "verified": true
      }
    ],
    "body": "## How she appears in the record\n\nJill S. Tangeman is **Vorys, Sater, Seymour and Pease** counsel on the company\n(Bistrozzi/BOSC) side, recurring across three threads:\n\n- **Company counsel on the Roadwork Development Agreement** — named in the RDA notice\n  block as company counsel (`jstangeman@vorys.com`)\n  ([RDA](../extracted/aedg/roadwork-development-agreement.rda.yaml)).\n- **The land-option assignments** — the PAAC purchase options (Brenneman, Neff, Pike\n  Run/Miller) were **assigned to Bistrozzi LLC** through Vorys/Tangeman (2025-07-03),\n  closing 2025-07-14 ([seller-land-packets](../extracted/aedg/seller-land-packets.land.yaml)).\n- **Permit contact of record** — she appears as `permit_contact` on numerous EPA\n  permit extractions (entity graph: permit_contact ×11).\n\nShe also appears (with Leis and Rex Huffman) in the Neff property **Conditional Use\nPermit** process in the PAAC board minutes (2024-10-24).\n\n## Why this matters\n\nTangeman and Scott Ziance are the two Vorys hands on the local deal paperwork: Ziance\non the CRA/NDA/SOS filings, Tangeman on the RDA and the land-option assignment chain.\nTogether they are the developer-side legal channel through which the land assembly and\nthe road/CRA instruments were executed.\n\n## Research status\n\nRoles are read from the cited extractions and are **common-control plumbing and leads\nto verify — not** statements about beneficial ownership or wrongdoing. To extend:\nconfirm the assignment instruments' recording details and her signature blocks."
  }
]
